{
  "version": 1,
  "name": "SampleFolio",
  "displayName": "Sample Folio",
  "family": "Light",
  "attribution": "Derived from Folio, original palette Copyright 2026 Julien Bombled, Apache-2.0. See ThemeForge NOTICE.",
  "colors": {
    "Background": "#F1F2F4",
    "CurrentLine": "#DCDFE4",
    "Selection": "#CBCFD7",
    "Foreground": "#17191C",
    "Comment": "#4D5973",
    "Cyan": "#0F707B",
    "Green": "#0F7829",
    "Orange": "#954D12",
    "Pink": "#B1165C",
    "Purple": "#8E18C1",
    "Red": "#B81717",
    "Yellow": "#68680D",
    "Surface": "#F1F2F4",
    "SurfaceAlt": "#DCDFE4",
    "Accent": "#8E18C1",
    "AccentHover": "#A546CD",
    "AccentPressed": "#6A1291",
    "TextPrimary": "#17191C",
    "TextSecondary": "#4D5973",
    "Border": "#DCDFE4",
    "Success": "#0F7829",
    "Warning": "#954D12",
    "Error": "#B81717",
    "Info": "#0F707B",
    "Blue": "#005FC2"
  }
}
